{
  "$schema": "http://json-schema.org/draft-07/schema#",
  "title": "Plate bending check of Base Plate as per Ch 2.8 of P207 Joints in Steel Construction - Moment Connections",
  "description": "Plate bending check of Base Plate as per Ch 2.8 of P207 Joints in Steel Construction - Moment Connections",
  "type": "object",
  "properties": {
    "image": {
      "type": "string",
      "description": "image. Bolt Plate Dimensions"
    },
    "fy": {
      "type": "number",
      "description": "Yield Strength of Plate, fy. Symbol: fy. Units: MPa",
      "default": 248,
      "minimum": 200,
      "maximum": 1000
    },
    "fu": {
      "type": "number",
      "description": "Tensile Strength of Plate, fu. Symbol: fu. Units: MPa",
      "default": 400,
      "minimum": 200,
      "maximum": 1500
    },
    "t": {
      "type": "number",
      "description": "Plate Thickness, t. Symbol: t. Units: mm. Plate thickness",
      "enum": [
        6,
        8,
        10,
        12,
        16,
        20,
        24,
        30,
        36,
        40,
        45,
        50,
        60
      ],
      "x-enumLabels": [
        "6",
        "8",
        "10",
        "12",
        "16",
        "20",
        "24",
        "30",
        "36",
        "40",
        "45",
        "50",
        "60"
      ],
      "default": 16
    },
    "b_p": {
      "type": "number",
      "description": "Width of base plate, bp. Symbol: b_p. Units: mm",
      "default": 200,
      "minimum": 100,
      "maximum": 1000
    },
    "x": {
      "type": "number",
      "description": "Tension Bolt centre to edge of Column, x. Symbol: x. Units: mm",
      "default": 50,
      "minimum": 20,
      "maximum": 200
    },
    "e_x": {
      "type": "number",
      "description": "Tension Bolt centre to edge of Base Plate - Long Direction, ex. Symbol: e_x. Units: mm",
      "default": 40,
      "minimum": 20,
      "maximum": 200
    },
    "g": {
      "type": "number",
      "description": "Distance between bolts, g. Symbol: g. Units: mm",
      "default": 100,
      "minimum": 50,
      "maximum": 500
    },
    "swf": {
      "type": "number",
      "description": "Flange weld size, swf. Symbol: swf. Units: mm",
      "default": 6,
      "minimum": 5,
      "maximum": 25
    },
    "Rs": {
      "type": "number",
      "description": "Bolt Row Ultimate Reaction (from other program), R*. Symbol: Rs. Units: kN",
      "default": 50,
      "minimum": 0,
      "maximum": 5000
    },
    "Ru": {
      "type": "number",
      "description": "Bolt Tensile Capacity of Row (nb x fub x Ab). Symbol: Ru. Units: kN",
      "default": 160,
      "minimum": 50,
      "maximum": 5000
    },
    "uid": {
      "type": "string",
      "const": "9075-mpads-steel-base-plate-check",
      "description": "Calculator unique identifier — must match the endpoint uid."
    },
    "current_unit_system": {
      "type": "string",
      "enum": [
        "metric",
        "imperial",
        ""
      ],
      "default": "metric",
      "description": "Unit system for input values and output display."
    },
    "project_details": {
      "type": "object",
      "description": "Optional project metadata for the PDF report header.",
      "properties": {
        "project_company": {
          "type": "string",
          "default": ""
        },
        "project_name": {
          "type": "string",
          "default": ""
        },
        "project_designer": {
          "type": "string",
          "default": ""
        },
        "project_id": {
          "type": "string",
          "default": ""
        },
        "project_client": {
          "type": "string",
          "default": ""
        },
        "project_notes": {
          "type": "string",
          "default": ""
        }
      }
    }
  }
}