{
  "fy": 248,
  "fu": 400,
  "t": 16,
  "b_p": 200,
  "x": 50,
  "e_x": 40,
  "g": 100,
  "swf": 6,
  "Rs": 50,
  "Ru": 160,
  "uid": "9075-mpads-steel-base-plate-check",
  "current_unit_system": "metric",
  "project_details": {
    "project_company": "",
    "project_name": "",
    "project_designer": "",
    "project_id": "",
    "project_client": "",
    "project_notes": ""
  }
}